id,paragraph_lemmatized
314,создание организовать группа в случай не предусмотренный статья особенный часть настоящий кодекс влечь уголовный ответственность за приготовление к тем преступление для совершение который она создать совершение преступление группа лицо группа лицо по предварительный сговор организовать группа или преступный сообщество преступный организация влечь более строгий наказание на основание и в предел предусмотренный настоящее кодекс эксцесс исполнитель преступление эксцесс исполнитель признаваться совершение исполнитель преступление не охватываться умысел другой соучастник за эксцесс исполнитель другой соучастник преступление уголовный ответственность не подлежать обстоятельство исключать преступность деяние статья 37 федеральный закон от 2002 29 фз 1
315,часть три ввести федеральный закон от 2003 162 фз статья 218 нарушение правило учёт хранение перевозка и использование взрывчатый легковоспламеняющийся вещество и пиротехнический изделие нарушение правило учёт хранение перевозка и использование взрывчатый легковоспламеняющийся вещество и пиротехнический изделие а также незаконный пересылка этот вещество по почта или багаж если этот деяние повлечь по неосторожность причинение тяжкий вред здоровье или смерть человек в ред федеральный закон от 2003 162 фз наказываться ограничение свобода на срок до пять год либо лишение свобода на срок до пять год с лишение право занимать определённый должность или заниматься определённый деятельность на срок до три год или без таковой
316,федеральный закон от 2003 162 фз 2 тот же деяние совершенный а группа лицо по предварительный сговор б в отношение автомобиль или иной имущество в крупный размер в ред федеральный закон от 2003 162 фз в утратить сила федеральный закон от 2003 162 фз наказываться ограничение свобода на срок до три год либо арест на срок от четыре до шесть месяц либо лишение свобода на срок до пять год с штраф в размер до восемьдесят тысяча рубль или в размер заработный плата или иной доход осудить за период до шесть месяц
317,продление изменение и прекращение применение принудительный мера медицинский характер 1 продление изменение и прекращение применение принудительный мера медицинский характер осуществляться суд по представление администрация учреждение осуществлять принудительный лечение на основание заключение комиссия лицо который назначить принудительный мера медицинский характер подлежать освидетельствование комиссия не реж один раз в шесть месяц для решение вопрос о наличие основание для внесение представление в суд о прекращение применение или о изменение такой мера освидетельствование такой лицо проводиться по инициатива лечить врач если в процесс лечение он прийти к вывод о необходимость изменение принудительный мера медицинский характер либо прекращение она применение а также по ходатайство самый лицо он законный представитель и или близкий родственник
318,федеральный закон от 2003 162 фз федеральный закон от 2005 93 фз внести изменение в абзац один часть два статья 142 вступать в сила по истечение шесть год после день вступление в сила указанный федеральный закон федеральный закон от 2005 93 фз из абзац первое часть два статья 142 исключить слово избирательный блок подделка подпись избиратель участник референдум в поддержка выдвижение кандидат список кандидат выдвинуть избирательный объединение избирательный блок инициатива проведение референдум или заверение заведомо подделать подпись подписной лист совершенный группа лицо по предварительный сговор или организовать группа либо соединить с подкуп принуждение применение насилие или угроза он применение а также с уничтожение имущество или угроза он уничтожение либо повлечь существенный нарушение право и законный интерес гражданин или организация либо охранять закон интерес общество или государство в ред
319,то же деяние совершенный организовать группа в ред федеральный закон от 2003 162 фз наказываться штраф в размер от сто тысяча до триста тысяча рубль или в размер заработный плата или иной доход осудить за период от один год до два год либо лишение свобода на срок до пять год федеральный закон от 2003 162 фз 3 незаконный получение спортсмен деньга ценный бумага или иной имущество передать имя в цель оказание влияние на результат указанный соревнование а равно незаконный пользование спортсмен услуга имущественный характер предоставить имя в тот же цель наказываться штраф в размер до триста тысяча рубль или в размер заработный плата или иной доход осудить за период до два год либо лишение право занимать определённый должность или заниматься определённый деятельность на срок до три год либо арест на срок от четыре до шесть месяц
320,принудительный мера медицинский характер мочь быть назначить суд лицо а совершить деяние предусмотренный статья особенный часть настоящий кодекс в состояние невменяемость б у который после совершение преступление наступить психический расстройство делать невозможный назначение или исполнение наказание в совершить преступление и страдать психический расстройство не исключать вменяемость в ред федеральный закон от 2003 162 фз год утратить сила федеральный закон от 2003 162 фз приказ минюст рф от 2001 229 утвердить инструкция по организация принудительный амбулаторный лечение от алкоголизм или наркомания осудить отбывать наказание в учреждение система минюст россия
321,ночь покрыть весь деревенский масштаб снег сделать воздух непроницаемый и тесный в который задыхаться грудь но весь же баба вскрикивать повсеместно и привыкать к горе держать постоянный вой собака и другой мелкий нервный животное тоже поддерживать этот томительный звук и в колхоз быть шумно и тревожный как в предбанник средний же и высокий мужик молча работать по двор и закут охранять бабий плач у раскрытый настежь ворота остаточный необобществленный лошадь грустно спасть в станок привязать к он так надёжно чтобы они никогда не упасть потому что иной лошадь уже стоять мёртвый в ожидание колхоз безубыточный мужик содержимый лошадь без пища чтоб обобществиться лишь один свой тело а животное не вести за себя в скорбь
322,федеральный закон от 2003 162 фз 2 тот же деяние совершенный а группа лицо группа лицо по предварительный сговор или организовать группа б по мотив национальный расовый религиозный ненависть или вражда а равно в отношение скульптурный архитектурный сооружение посвятить борьба с фашизм или жертва фашизм либо место захоронение участник борьба с фашизм в с применение насилие или с угроза он применение наказываться ограничение свобода на срок до три год либо арест на срок от три до шесть месяц либо лишение свобода на срок до три год
323,как прийд так встать и дьявол я досаждать блудить заставливать я закричать так и сесть егда стряпать в то время есть просить и украсть тщиться до время обед а егда пред обед отец наш проговорить и благословить так товый брашно и не есть просить неблагословеннов и я он сила в рота напехая и он и плакать и глотать и как рыба покормить тогда бес в немой вздивиячиться 104 а сам из он говорить ты я ослабить и я плакався пред владыка опять пост стягну и окрочть ево христос
324,считать хоть семь небо хоть восемь над земля ведь не изменить они движение разум твой раз нужно умереть не весь ль равно в гробница съесть муравей ты иль волк в глушь степной что делать я с сердце мой мёртвый хороший в могила спокойный имя сколько раз я ни каяться сколько ни плакать весь грешить если хотеть чтоб крепкий быть бытие основа и хотя бы два день провести без уныние злой никогда не чуждаться веселие и пить всегда чтоб успеть весь услада испить из фиал земной
325,понятие соучастие в преступление соучастие в преступление признаваться умышленный совместный участие два или более лицо в совершение умышленный преступление соучастник преступление наряду с исполнитель признаваться организатор подстрекатель и пособник исполнитель признаваться лицо непосредственно совершить преступление либо непосредственно участвовать в он совершение совместно с другой лицо соисполнитель а также лицо совершить преступление посредством использование другой лицо не подлежащее уголовный ответственность в сила возраст невменяемость или другой обстоятельство предусмотренный настоящее кодекс организатор признаваться лицо организовать совершение преступление или руководить он исполнение а равно лицо создать организовать группа или преступный сообщество преступный организация либо руководить они
326,стоячий мужик открыть рот и глядеть на карандаш с томление слабый душа который появиться у они из последний остаток имущество потому что стать мучиться чиклин и вощев тесать в два топор сразу и бревно у они складываться один к другой вплоть основывать сверху просторный место ближний середняк прислониться голова к крыльцо и стоялый в такой покой некоторый время товарищ актив а товарищ говорить ясно предложить середняк активист между свой дело дозволить мы горе горевать в остатний ночь а уж тогда мы век с ты быть радоваться
327,федеральный закон от 2003 162 фз статья 237 сокрытие информация о обстоятельство создавать опасность для жизнь или здоровье человек 1 сокрытие или искажение информация о событие факт или явление создавать опасность для жизнь или здоровье человек либо для окружающий среда совершенный лицо обязать обеспечивать население и орган уполномоченный на принятие мера по устранение такой опасность указанный информация в ред федеральный закон от 1999 50 фз наказываться штраф в размер до триста тысяча рубль или в размер заработный плата или иной доход осудить за период до два год либо лишение свобода на срок до два год с лишение право занимать определённый должность или заниматься определённый деятельность на срок до три год или без таковой
328,пока с ты весна здоровье и любовь пусть мы дать вино багряный гроздь кровь ты глупец беспечный однажды закопать не откопать вновь печаль грудь мой полный без мера нынче выпить я вино пушок твой ланита так юный и нежный что новый пришлый к я весна небо кушак что облечь изнурённый мой стан волна джейхуна родить наш слеза океан ада это искорка наш пылать вздох рай это отдых что мы на мгновение дать вы кумирня и храм мы кумир и чаша с вино
329,федеральный закон от 2003 162 фз 2 тот же деяние совершенный а группа лицо по предварительный сговор б утратить сила федеральный закон от 2003 162 фз в лицо с использование свой служебный положение наказываться лишение свобода на срок от три до пять год с штраф в размер до восемьдесят тысяча рубль или в размер заработный плата или иной доход осудить за период до шесть месяц либо без таковой федеральный закон от 2004 73 фз 3
330,федеральный закон от 2003 162 фз от 2004 175 фз о практика применение суд законодательство о ответственность за совершение преступление предусмотренный статья 254 ук рф сантиметр постановление пленум верховный суд рф от 1998 14 отравление загрязнение или иной порча земля вредный продукт хозяйственный или иной деятельность вследствие нарушение правило обращение с удобрение стимулятор рост растение ядохимикат и иной опасный химический или биологический вещество при они хранение использование и транспортировка повлечь причинение вред здоровье человек или окружающий среда наказываться штраф в размер до двести тысяча рубль или в размер заработный плата или иной доход осудить за период до восемнадцать месяц либо лишение право занимать определённый должность или заниматься определённый деятельность на срок до три год либо исправительный работа на срок до два год
331,виновный в преступление признаваться лицо совершить деяние умышленно или по неосторожность деяние совершенный только по неосторожность признаваться преступление лишь в случай когда это специально предусмотреть соответствующий статья особенный часть настоящий кодекс федеральный закон от 1998 92 фз статья 25 преступление совершенный умышленно признаваться деяние совершенный с прямая или косвенный умысел преступление признаваться совершенный с прямая умысел если лицо осознавать общественный опасность свой действие бездействие предвидеть возможность или неизбежность наступление общественно опасный последствие и желать они наступление преступление признаваться совершенный с косвенный умысел если лицо осознавать общественный опасность свой действие бездействие предвидеть возможность наступление общественно опасный последствие не желать но сознательно допускать этот последствие либо относиться к он безразличный
332,и к место говорить на дворец к спас на силино покойник место да бог не изволить а се и у я радение худо быть любо я у казанский той держаться чело народ книга в памести никон писать год и число по предание святой апостол и святой отец не подобать в церковь метание 34 творити на колено но в пояс бы вы творити поклон ещё же и трема перст бы ест креститься мы же задумалисить сошедшести между себя видеть яко зима хоскать быть сердце озябнуть и нога задрожать
333,федеральный закон от 2003 162 фз статья 187 изготовление или сбыт поддельный кредитный либо расчётный карта и иной платёжный документ о отказ в принятие к рассмотрение жалоба на нарушение конституционный право положение часть один статья 187 сантиметр определение конституционный суд рф от 2005 69 о изготовление в цель сбыт или сбыт поддельный кредитный либо расчётный карта а также иной платёжный документ не являться ценный бумага наказываться лишение свобода на срок от два до шесть год с штраф в размер от сто тысяча до триста тысяча рубль или в размер заработный плата или иной доход осудить за период от один год до два год
334,нецелевой расходование средство государственный внебюджетный фонд ввести федеральный закон от 2003 162 фз 1 расходование средство государственный внебюджетный фонд должностной лицо на цель не соответствующий условие определённый законодательство российский федерация регулировать они деятельность и бюджет указанный фонд совершенный в крупный размер наказываться штраф в размер от сто тысяча до триста тысяча рубль или в размер заработный плата или иной доход осудить за период от один год до два год либо арест на срок от четыре до шесть месяц либо лишение свобода на срок до два год с лишение право занимать определённый должность или заниматься определённый деятельность на срок до три год или без таковой
