id,paragraph_lemmatized
648,прошептать вощев над это безмолвный туловище так вот отчего я смысл не знать ты должный быть не я а весь класс испить сухой душить а мы бродить как тихий гуща и не знать ничто и вощев ударить активист в лоб для прочность он гибель и для собственный сознательный счастие почувствовать полный ум хотя и не умный ещё произнести или выдвинуть в действие он первоначальный сила вощев встать на нога и сказать колхоз теперь я быть за вы горевать вощев отворить дверь оргдома в пространство и узнать желание жить в этот разгородить даль где сердце мочь биться не только от один холодное воздух но и от истинный радость одоление всего смутный вещество земля
649,ведь вы же знаете что такой отношение знать сказать утка я частенько относить свой ребёнок червячок или лягушонок но вопрос в тот что такой отношение князь мышь на вопрос этот не ответить и поспешно продолжать обостриться то против они подняться князь ольг и не раз сила завладевать киев но мономах в свой очередь как вы себя чувствовать мой милый насквозь промокнуть уныло сказать аня ваш слово на я видно не действовать
650,и батюшко смотрил белый у ухо тот они да и поклонилася я прощение просить егда я сослать из тобольск и я оставить ея у сын духовнагой тут хотеть пострищися а дьявол опять сделать пошлый за елизар замуж и детка прижить и по осьмить летёха услышать что я еда назад отпросилася у муж и постригласить а как замужем быть по время бог наказывать бес мучить ея егда ж аз в тоболеск приехать за месяц до я постригласить и принести к я два детище и положа пред я робятишок плакать и рыдать кающести бесстыдно порицать себя
651,жестокий же быть бес в немой соблудить в велик день с жена свой наругать праздник жена ево сказывать да и взбеситься и я в дом свой держать месяц с два стужать о немой божество в церковь водить и масло освятить и помиловать бог здравый бысть и ум исцеле и стать с я на крылось петь в литоргия в время перенос и досадить я аз в то время побить он на крылось и в притвор 107 велеть пономарь приковать к стена и он вышатать проба пуща и первова вбеситься в обедня уйти на двор к большой воевода и сундук разломать платье княинино на себя вздеть а они розгонять
652,федеральный закон от 2003 162 фз о судебный практика по дело о изготовление или сбыт поддельный деньга или ценный бумага сантиметр постановление пленум верховный суд рф от 1994 2 изготовление или сбыт поддельный деньга или ценный бумага 1 изготовление в цель сбыт или сбыт поддельный банковский билет центральный банка российский федерация металлический монета государственный ценный бумага или другой ценный бумага в валюта российский федерация либо иностранный валюта или ценный бумага в иностранный валюта наказываться лишение свобода на срок от пять до восемь год с штраф в размер до один миллион рубль или в размер заработный плата или иной доход осудить за период до пять год либо без таковой
653,вскоре порядок быть наладить и игра начаться аня никогда в жизнь не видеть такой странный крокетный площадка она быть весь в ямка и в борозда шар служить живой ёж молоток живой фламинго солдат же выгнуть спина стоять на четвереньки изображать дужка аня не сразу научиться действовать свой фламинго она наконец удаться взять он довольно удобно так что тело он приходиться она под мышка а нога болтаться сзади но как только она выпрямлять он шея и собираться голова он стукнуть по свёрнутый ёж фламинго да и выгнуться назад глядеть она в лицо с такой недоумение что нельзя быть не расхохотаться
654,федеральный закон от 2003 162 фз 3 деяние предусмотренный частью один настоящий статья повлечь по неосторожность смерть два или более лицо наказываться лишение свобода на срок до семь год с лишение право занимать определённый должность или заниматься определённый деятельность на срок до три год или без таковой часть три ввести федеральный закон от 2003 162 фз примечание крупный ущерб в статья настоящий глава признаваться ущерб сумма который превышать пятьсот тысяча рубль примечание ввести федеральный закон от 2003 162 фз статья 217
655,вощев и ещё три убедить мужик носить бревно к ворот оргдвор и складывать они в штабель имя заранее активист дать указание на этот труд чиклин тоже пойти за трудящийся и взять бревно около овраг понести он к оргдвор пусть идти большой польза в общий котёл чтоб не быть так печально вокруг ну как же быть гражданин произнести активист в вещество народ находиться пред он вы что ж опять капитализм сеять собираться иль опомниться организовать сесть на земля и курить с удовлетворительный чувство поглаживать свой бородка который за последний полгода стать реж растить неорганизованный же стоять на нога превозмогать свой тщетный душить но один сподручный актив научить они что душа в они нет а есть лишь один имущественный настроение и они теперь вовсе не знать как имя статься раз не быть имущество
656,довод королева быть тот что если сей сей сей сей же минута не быть сделать она приказать казнить весь окружающий замечание и быть причина тот что у весь быть такой унылый и тревожный вид аня мочь ответить только один кот принадлежать герцогиня она в тюрьма сказать королева палач тут голова кот стать таять и когда наконец привести герцогиня ничто уже не быть видно король и палач ещё долго носиться взад и вперёд отыскивать приговорить остальной же послать продолжать прервать игра
657,я кричать мой враг не пить вино вино издревле вера враг и в тот мы заповедь дать они открыть я глаз когда вино ислам враг клясться аллах быть пить с тот пора как на небо зажечься луна и светлый зухра мы смертный высокий дать блаженство пить вино с утро вино кабатчик продавать а сам глупец глотка не пить источник счастие у он какой ждать ещё добро зачем ты я явить сперва великодушие и милость
658,это быть не особенно подбадривать начало для разговор аня отвечать несколько застенчиво я я не совсем точно знать кто я быть когда встать утром а кроме тот с тот пора я несколько раз меняться что ты хотеть сказать это в и дело что я трудно себя объяснить отвечать аня потому что видеть ли я не я я не видеть сухо сказать гусеница я бояться что не мочь выразиться ясный очень вежливый ответить аня
659,в этот минута она увидеть перед себя весёлый чистенький домик на дверь который быть блестящий медный дощечка с слово дворянин кролик трусик аня войти не стучать и взбежать по лестница очень поспешно так как бояться встретить настоящий маша который вероятно тут же выгнать бы она не дать она найти веер и перчатка как это весь дико говорить аня про себя быть на побегушки у кролик тот и глядеть мой дин стать посылать я с поручение и она представить себя как это быть барышня идти одеваться к прогулка сейчас няня сейчас
660,свой у я вовсе нет тут королева надеть очки и стать в упор смотреть на свидетель который побледнеть и заёрзать дать свой показание сказать король и не ёрзать а то я приказать казнить ты тут же он продолжать переступать с нога на нога тревожный поглядывать на королева в свой смущение он откусить большой кусок чашка вместо хлеб в тот же минута аня охватить странный ощущение который сначала она очень озадачить и вдруг она понять в чем дело она снова начало растить
661,напрасно напрасно я упомянуть про дин уныло сказать она про себя никто она здесь не любить я же убедить что она хороший кошка на свет неужели я ты никогда большой не увидеть и тут аня снова заплакать чувствовать себя очень угнести и одинокий через несколько минута однако она услышать шуршание лёгкое шаг и быстро поднять голова смутно надеяться что мышь решить вернуться чтобы докончить свой рассказ глава 4 лететь в труба это быть белый кролик который тихо семенить назад тревожный поглядывать по сторона словно искать
662,преступление в сфера компьютерный информация статья 272 неправомерный доступ к компьютерный информация 1 неправомерный доступ к охранять закон компьютерный информация то есть информация на машинный носитель в машина эвм система эвм или они сеть если это деяние повлечь уничтожение блокирование модификация либо копирование информация нарушение работа эвм система эвм или они сеть наказываться штраф в размер до двести тысяча рубль или в размер заработный плата или иной доход осудить за период до восемнадцать месяц либо исправительный работа на срок от шесть месяц до один год либо лишение свобода на срок до два год
663,федеральный закон от 2003 162 фз статья 138 нарушение тайна переписка телефонный переговоры почтовый телеграфный или иной сообщение 1 нарушение тайна переписка телефонный переговоры почтовый телеграфный или иной сообщение гражданин наказываться штраф в размер до восемьдесят тысяча рубль или в размер заработный плата или иной доход осудить за период до шесть месяц либо обязательный работа на срок от сто двадцать до сто восемьдесят часы либо исправительный работа на срок до один год федеральный закон от 2003 162 фз 2
664,ты прежде мочь не спать не пить не насыщаться стихия в тот ты заставить нуждаться но весь что дать вновь отнять у ты даба свободный ты как прежде мочь остаться глядеть в рука остаться веяние один на истребление и распад весь сущий обречь считать что сущий теперь не существовать на земля есть то что навсегда уйти и что ещё не родить никто не победить грозить сила небо и не насытиться навек дар хлеб кичиться рано ты что целый и невредимый ещё съесть ты когда прийти потреба
665,развратный действие совершение развратный действие без применение насилие лицо достигнуть восемнадцатилетний возраст в отношение лицо заведомо не достигнуть шестнадцатилетний возраст в ред федеральный закон от 2003 162 фз от 2004 73 фз наказываться штраф в размер до триста тысяча рубль или в размер заработный плата или иной доход осудить за период до два год либо ограничение свобода на срок до два год либо лишение свобода на срок до три год федеральный закон от 2003 162 фз глава 19
666,где я найти бальзам когда сознание целительница наш отуманить чаша вино я дорогой держава кавуса трон кубада и слава отважный туса стон влюбить что слышаться я на рассвет выше молитва и отшельнический искус ты не мечтать перевалить за семь десяток год так пусть же пьяный заставать всегда ты рассвет пока из голов твой не сделать кувшин кувшин с чаша дать любовь и верность обет пред тем как испытать превратность сполна распить сегодня ратль вино что завтра мы сулить вращение небосвод быть мочь и вод не быть мы дать
667,федеральный закон от 2003 162 фз 2 получение должностной лицо взятка за незаконный действие бездействие наказываться лишение свобода на срок от три до семь год с лишение право занимать определённый должность или заниматься определённый деятельность на срок до три год деяние предусмотренный часть один или два настоящий статья совершенный лицо занимать государственный должность российский федерация или государственный должность субъект российский федерация а равно главый орган местный самоуправление наказываться лишение свобода на срок от пять до десять год с лишение право занимать определённый должность или заниматься определённый деятельность на срок до три год
668,это один мой друг масляничный кот объяснить аня я не нравиться он улыбка сказать король впрочем он если хотеть мочь поцеловать мой рука предпочитать это не делать заметить кот и не смотреть на я так говорить это он спрятаться за аня смотреть всякий мочь возразить кот король с решительный вид обратиться к королева который как раз проходить мимо мой друг сказать он приказать пожалуйста убрать это кот
669,первое что нужно я сделать это вернуться к свой настоящий рост а два пробраться в тот чудесный сад вот кажется хороший план план быть что и говорить великолепный очень стройный и простой единственный затора быть то что она не иметь ни маленький представление как привести он в исполнение и пока она тревожный вглядываться в просвет между ствол резкий тявканье заставить она поспешно поднять голова исполинский щенок глядеть на нея сверху огромный круглый глаз и осторожно протягивать лапа стараться дотронуться до она платье
670,федеральный закон от 2003 162 фз при назначение наказание по совокупность преступление или по совокупность приговор вид срок или размер наказание назначаться по правило предусмотренный статья 69 и 70 настоящий кодекс федеральный закон от 2003 162 фз 4 при назначение наказание лицо признанный вердикт присяжный заседатель виновный в совершение преступление но заслуживать снисхождение обстоятельство отягчать наказание не учитываться федеральный закон от 2003 162 фз статья 66 назначение наказание за неоконченный преступление 1
671,федеральный закон от 2003 162 фз примечание лицо добровольно прекратить участие в преступный сообщество преступный организация или входящий в он нея структурный подразделение либо объединение организатор руководитель или иной представитель организовать группа и активно способствовать раскрытие или пресечение это преступление освобождаться от уголовный ответственность если в он действие не содержаться иной состав преступление примечание ввести федеральный закон от 2003 162 фз статья 211 угон судный воздушный или водный транспорт либо железнодорожный подвижный состав 1 угон судный воздушный или водный транспорт либо железнодорожный подвижный состав а равно захват такой судный или состав в цель угон наказываться лишение свобода на срок от четыре до восемь год
672,тихо произнести лори и при это он всего передёрнуть спросить мышь нахмуриться но очень учтивый вы кажется изволить я сказать нет нет поспешно забормотать лори я значит показаться сказать мышь итак я продолжать очень способный князь мстислав в киев один за другой княжить он родные брат пока они жить дружно они власть быть крепкий когда же они отношение обостриться в какой отношение в отношение они отношение ответить мышь довольно сердито
673,идти давать попробовать один фигура обратиться чепупах к гриф мы ведь мочь обойтись без омар ты петь сказать гриф и вот они начать торжественно плясать вокруг ани изредка наступать она на нога когда подходить слишком близко и отбивать такт огромный лапа между тем как чепупах петь очень медленно и уныло ты не мочь скорый подвигаться каракатица катиться сзади наступать на хвост я слегка увлечь черепаха омар и послать выкрутасы писать мы у море ты ожидать приходить же и ты поплясать
