id,paragraph_lemmatized
990,а я говорить христос я пронести и пречистый богородица провести я не бояться никовый одново бояться христос тажа в москва приехать и яко ангел божий прияша мя государь и боярить весь я ради к федора ртищево зайти он сам из полатка выскочить к я благословиться от я и учали говорить три день и три нощь домой я не отпустить и потом царь о я известить государь я тотчас к рука поставить велеть и слово милостивый говорить здорово протопоп жить
991,всесвятой троица бог и содетель всего мир поспешить и направить сердце мой начать с разум и кончать дел благой яже ныне хостить глаголати аз недостойный разуметь же свой невежество припадать молить ти ся и ёж от ты помощь просить управить ум мой и утвердить сердце мой приготовитися на творение добрый дело да добрый дел просвещённый на судищий десный 2 ти страна причастник быть с весь избранный твой и ныне владыкий благословить да воздохнуть от сердце и язык возглаголь дионисий ареопагит о божественный именех что есть бог присносущный имя истинный ёж есть близостный и что виновный сиречь похвальный
992,там он начать тщательно работать над выдумать часть общепролетарский дом чтобы ощущать предмет и позабыть человек в свой воспоминание час через два вощев принести он образец грунт из разведочный скважина наверно он знать смысл природный жизнь тихо подумать вощев о прушевский и томить свой последовательный тоска спросить а вы не знаете отчего устроиться весь мир прушевский задержаться внимание на вощева неужели онитоже быть интеллигенция неужели наскапитализм родить двоешка бог мой какой у он уже теперь скучный лицо не знать ответить прушевский
993,федеральный закон от 2003 162 фз наказываться лишение свобода на срок до пять год о судебный практика по дело о нарушение правило пожарный безопасность уничтожение или повреждение имущество путём поджог либо в результат неосторожный обращение с огонь сантиметр постановление пленум верховный суд рф от 2002 14 уничтожение или повреждение имущество по неосторожность в ред федеральный закон от 2003 162 фз уничтожение или повреждение чужое имущество в крупный размер совершенный путём неосторожный обращение с огонь или иной источник повышенный опасность наказываться штраф в размер до сто двадцать тысяча рубль или в размер заработный плата или иной доход осудить за период до один год либо исправительный работа на срок от один год до два год либо ограничение свобода на срок до три год либо лишение свобода на срок до один год
994,преступление в сфера экономический деятельность статья 169 воспрепятствование законный предпринимательский или иной деятельность в ред федеральный закон от 2002 72 фз 1 неправомерный отказ в государственный регистрация индивидуальный предприниматель или юридический лицо либо уклонение от они регистрация неправомерный отказ в выдача специальный разрешение лицензия на осуществление определённый деятельность либо уклонение от он выдача ограничение право и законный интерес индивидуальный предприниматель или юридический лицо в зависимость от форма а равно незаконный ограничение самостоятельность либо иной незаконный вмешательство в деятельность индивидуальный предприниматель или юридический лицо если этот деяние совершить должностной лицо с использование свой служебный положение в ред
995,федеральный закон от 2003 162 фз 3 незаконный получение лицо выполнять управленческий функция в коммерческий или иной организация деньга ценный бумага иной имущество а равно незаконный пользование услуга имущественный характер за совершение действие бездействие в интерес давать в связь с занимать это лицо служебный положение наказываться штраф в размер от сто тысяча до триста тысяча рубль или в размер заработный плата или иной доход осудить за период от один год до два год либо лишение право занимать определённый должность или заниматься определённый деятельность на срок до два год либо ограничение свобода на срок до три год либо лишение свобода на срок до три год
996,деяние предусмотренный часть один или два настоящий статья совершенный лицо с использование свой служебный положение наказываться штраф в размер от сто тысяча до триста тысяча рубль или в размер заработный плата или иной доход осудить за период от один год до два год либо лишение свобода на срок до четыре год с лишение право занимать определённый должность или заниматься определённый деятельность на срок до три год или без таковой федеральный закон от 2003 162 фз статья 295 посягательство на жизнь лицо осуществлять правосудие или предварительный расследование посягательство на жизнь судья присяжный заседатель или иной лицо участвовать в отправление правосудие прокурор следователь лицо производить дознание защитник эксперт специалист судебный пристав судебный исполнитель а равно они близкие в связь с рассмотрение дело или материал в суд производство предварительный расследование либо исполнение приговор решение суд или иной судебный акт совершенный в цель воспрепятствование законный деятельность указанный лицо либо из месть за такой деятельность в ред
997,деяние предусмотренный часть два или три настоящий статья совершенный организовать группа наказываться лишение свобода на срок от десять до пятнадцать год с штраф в размер до один миллион рубль или в размер заработный плата или иной доход осудить за период до пять год либо без таковой федеральный закон от 2004 73 фз статья 175 приобретение или сбыт имущество заведомо добыть преступный путём 1 заранее не обещать приобретение или сбыт имущество заведомо добыть преступный путём наказываться штраф в размер до сорок тысяча рубль или в размер заработный плата или иной доход осудить за период до три месяц либо обязательный работа на срок от сто восемьдесят до двести сорок часы либо исправительный работа на срок от один год до два год либо лишение свобода на срок до два год
998,и в то время пища довольно прислать а опосле товый вскоре хотеть я пытать слушай за что отпускать он сын своевый еремей в мунгальский царство воевать казаков с он 72 человек да иноземцов 20 человек и заставить иноземец шаманить сиречь гадать удастлисить имя и с победа ли быть домой волхв же тот мужик близ мой зимовье привести баран живов в вечер и учалый над он волхвовать вертеть ево много и голова прочь отвертеть и прочь отбросить и начать скакать и плясать и бес призывать и много кричать о земля удариться и пена из рот пошлый
999,активист представить чиклин что этот дворовый элемент есть смертельный вредитель сафронов и козлов но теперь он заметить свой скорбь от организовать движение на он и сам прийти сюда лечь на стол между покойный и лично умереть весь равно бы я он обнаружить через полчаса сказать активист у мы стихия сейчас нет ни капля деться никто некуда а ещё один лишний лежать тот я закончить объяснить чиклин думать что стервец явиться и просить удар я он дать а он ослабнуть
1000,ходатайство подаваться через администрация учреждение осуществлять принудительный лечение вне зависимость от время последний освидетельствование при отсутствие основание для прекращение применение или изменение принудительный мера медицинский характер администрация учреждение осуществлять принудительный лечение представлять в суд заключение для продление принудительный лечение первое продление принудительный лечение мочь быть произвести по истечение шесть месяц с момент начало лечение в последующий продление принудительный лечение производиться ежегодно федеральный закон от 2001 26 фз 3 изменение или прекращение применение принудительный мера медицинский характер осуществляться суд в случай такой изменение психический состояние лицо при который отпадать необходимость в применение ранее назначить мера либо возникать необходимость в назначение иной принудительный мера медицинский характер
1001,ведь пьющий утром вино не тосковать о рай не бояться и адский огонь когда фиалка лить благоухание и веять ветер вешний дыхание мудрец кто пить с возлюбить вино разбить о камень чаша покаяние расстилатель ковровый служить ветер весна мы сегодня без вино и цветок весь мир не нужный мы сегодня всеять община пить сегодня вино мудрец кровь лоза и сокровище роза дать мы сегодня утро сыпать из облако розовый лепесток будто на земля сыпаться роза из рука чаша лилия розовый я наполнять вино ибо с небо жасмина слетать на берег река
1002,федеральный закон от 2003 162 фз 2 то же деяние повлечь по неосторожность смерть человек в ред федеральный закон от 2003 162 фз наказываться ограничение свобода на срок до пять год или лишение свобода на срок до пять год с лишение право занимать определённый должность или заниматься определённый деятельность на срок до три год или без таковой федеральный закон от 2003 162 фз 3 деяние предусмотренный частью один настоящий статья повлечь по неосторожность смерть два или более лицо наказываться лишение свобода на срок до семь год с лишение право занимать определённый должность или заниматься определённый деятельность на срок до три год или без таковой
1003,кафельный завод быть в травянистый переулок по который насквозь никто не проходить потому что он упираться в глухой стен кладбище здание завод теперь стать ниже ибо постепенно врастать в земля и безлюдно быть на он двор но один неизвестный старичок ещё находиться здесь он сидеть под навес для сырьё и чинить лапоть видно собираться отправляться в они обратно в старина что ж тут такой есть тут дорогой человек констервация советский власть сильный а здешний машина тщедушный она и не угождать да я теперь почти что весь равно уж самый малость остаться дышать
1004,я подметать борода порог кабаков проститься и с добром и зло великое два мир пусть оба мир упасть ты они в я найти когда лежать мертвецк пьяный в один из погребок ты расставлять западня на весь путь мой грозить убить коль попасться я вдруг в один из они а тот кто в они попасть бунтовщик ты звать и убивать они уходить как бывать в обитель год пусть смеяться лишь тот уходящим вслед кто прожить собираться тысяча год чтоб до седой волос дожить есть мудрость не мало я смочь познать лишь два из они я в жизнь они хватать уж хороший голодать чем что попасть есть и хороший один чем вместе с кто попасть
1005,дать розовый я вино как цвета твой ланита запутанный мой извилистый путь как локон твой сперва мой ум по небо блуждать скрижаль калам и рай и ада искать сказать я разум рай и ада с ты весь ты нести в себя что алкать здесь я чаша вино и струна золотой в рай ты метить но это приманка пустой слово о рай и ада не слушай мудрец быть мой приход не по мой вина и мой уход не по мой вина
1006,яздать премудрый нога мы и рука крепкий давать хранить имя твой лютый враг в довольство в радость жить пусть фляга винный мой ислам не освятить из тыква сделать она а тыква разрешить плод коль на дега у ты один лепёшка есть и в сила ты кувшин вода себя привесть что за нужда ты презренный подчиняться и низкий угождать свой терять честь око если ты не слепо видеть ряд надгробие старинный этот мир соблазн полный топить весь в смятенный пучина полководец падишах в земля тёмный погрузиться
1007,сдерживать сила свой инициатива неподвижно стоялый активист среди всеобщий тишина колхоз и он подручный товарищ глядеть на он смолкнуть уста не знать куда имя двинуться чиклин и вощев выйти с оргдвор и отправиться искать мёртвый инвентарь чтобы увидеть он годность пройти некоторый расстояние они остановиться на путь потому что с правый сторона улица без труд человек открыться один ворот и через они стать выходить спокойный лошадь ровный шагом не опускать гол к расти пища на земля лошадь сплотить масса миновать улица и спуститься в овраг в который содержаться вод
1008,при признание рецидив преступление не учитываться а судимость за умышленный преступление небольшой тяжесть б судимость за преступление совершенный лицо в возраст до восемнадцать год в судимость за преступление осуждение за который признаваться условный либо по который предоставляться отсрочка исполнение приговор если условный осуждение или отсрочка исполнение приговор не отменяться и лицо не направляться для отбывание наказание в место лишение свобода а также судимость снятой или погасить в порядок установленный статья 86 настоящий кодекс рецидив преступление влечь более строгий наказание на основание и в предел предусмотренный настоящее кодекс
1009,и она прислониться к телега озаботить упущение вощев прибыть на подвод из неизвестный место тронуть лошадь чтобы ехать обратно в то пространство где он быть оставить блюсти девочка жачева чиклин пойти шагом за удалиться телега до самый глубина лунный ночь он идти вдаль изредка в боков овражный сторона гореть укромный огонь неизвестный жилища и там же заунывно брехать собака мочь быть они скучать а мочь быть замечать въезжать командировать человек и пугаться они впереди чиклин весь время ехать подвод с гроб и он не отрываться от нея
1010,федеральный закон от 2003 162 фз примечание лицо совершить преступление предусмотренный настоящий статья освобождаться от уголовный ответственность если оно добровольный и своевременный сообщение орган власть или иной способ способствовать предотвращение осуществление акт терроризм либо пресечение указанный в настоящий статья преступление террористический характер и если в действие это лицо не содержаться иной состав преступление захват или удержание лицо в качество заложник совершенный в цель понуждение государство организация или гражданин совершить действие или воздержаться от совершение действие как условие освобождение заложник наказываться лишение свобода на срок от пять до десять год
1011,штраф есть денежный взыскание назначать в предел предусмотренный настоящее кодекс федеральный закон от 2003 162 фз 2 штраф устанавливаться в размер от два тысяча пятьсот до один миллион рубль или в размер заработный плата или иной доход осудить за период от два неделя до пять год штраф в размер от пятьсот тысяча рубль или в размер заработный плата или иной доход осудить за период свыше три год мочь назначаться только за тяжкий и особо тяжкий преступление в случай специально предусмотренный соответствующий статья особенный часть настоящий кодекс федеральный закон от 2003 162 фз 3
