id,paragraph_lemmatized
1,но тот кто сведущий в таинство творение не сеять в сердце этот сорняк к в детство мы ходить и мудрость потом глупец учить и туча прах по ветер уплыть от неверие до вера расстояние вздох один от сомнение и искание до познание вздох один провести в веселие это драгоценный мгновение ибо наш расцвет и наш увядание вздох один кровь влюбить не лей они живой сердце пожалеть хороший каяться как опасный безумец убить хороший кровь этот тысяча от мир уйти аскет ты железо пролить но ни капля вино не пролить
2,часть ввести федеральный закон от 2003 162 фз 7 суд мочь дать указание орган исполнять наказание о учёт при обращение с несовершеннолетний осудить определённый особенность он личность о судебный практика по дело о преступление несовершеннолетний сантиметр постановление пленум верховный суд рф от 2000 7 при назначение наказание несовершеннолетний кроме обстоятельство предусмотренный статья 60 настоящий кодекс учитываться условие он жизнь и воспитание уровень психический развитие иной особенность личность а также влияние на он старший по возраст лицо несовершеннолетний возраст как смягчающий обстоятельство учитываться в совокупность с другой смягчающий и отягчать обстоятельство
3,елисей стоять тихо в сторона сказать вскоре чиклин что мужик стихнуть нет ответить елисей положь он в серёдка между мой товарищ елисей поволока мужик к стол и поднять он из весь сила свалить поперёк прежний мёртвый а уж потом приноровить как следовать уложить он тесно близ боков сафронов и козлов когда елисей отойти обратно то мужик открыть свой жёлтый глаз но уже не мочь они закрыть и так остаться глядеть один находиться ответить елисей вощев прийти в дверь и сказать чиклин чтоб он идти он требовать актив
4,ну девка смочь проговорить сафронов сознательный женщина твой мать и глубокий наш советский власть раз даже ребёнок не помнить матерь уже чуять товарищ ленин безвестный мужик с жёлтый глаз скулила в угол барак про один и то же свой горе только не говорить отчего оно а стараться большой весь угождать он тоскливый ум представляться деревня в ржа и над нея носиться ветер и тихо крутило деревянный мельница размалывать насущный мирный хлеб он жить так в недавний время чувствовать сытость в желудок и семейный счастие в душа и сколько год он ни смотреть из деревня вдаль и в будущее он видеть на конец равнина лишь слияние небо с земля а над себя иметь достаточный свет солнце и звезда
5,богатство кичиться звенеть серебро и злато блестеть это я но только делишки настроить на лада и знатный глядеть и богатый как из засада подняться смерть и говорить это я я из предел ложь решить сокрыться здесь жить лишь сердце попусту томиться пусть наш смерть радоваться тот кто сам от смерть мочь защититься чаяние твой определить вчерашний день себя от прежний просьба твой освободить вчерашний день ни о чем ты не расспросить вчерашний день что завтра сбыться с ты не приоткрыть вчерашний день
6,мастеровой сесть в ряд по длина стол косарь ведать женский дело в барак нарезать хлеб и дать каждый человек ломоть а в прибавка ещё по кусок вчерашний холодный говядина мастеровой начать серьёзно есть принимать в себя пища как должное но не наслаждаться она хотя они и владеть смысл жизнь что равносильный вечный счастие однако они лицо быть угрюмый и худой а вместо покой жизнь они иметь измождение вощев с скупость надежда с страх утрата наблюдать этот грустно существующий человек способный без торжество хранить внутри себя истина он уже быть довольный и тем что истина заключаться на свет в ближний к он тело человек который сейчас только говорить с он значит достаточно лишь быть около тот человек чтобы стать терпеливый к жизнь и трудоспособный
7,прежде чем рассыпаться в прах мой живой сосуд доля взять я от радость каждый земной тянуться хайям если ты вино опьянить благодарствовать судьба если с возлюбить уединённый благодарствовать судьба конец истребление явление весь завершение пока ты смерть не истребить благодарствовать судьба коль мочь не тужить о время бежать не отягчать душа ни прошлое ни грядущий сокровище свой потратить пока ты живой ведь весь равно в тот мир предстать неимущий ты брать свой доля из круговорот время восседать на престол веселие вино опьянеть
8,тогда при царь иван быш на собор знаменоносец гурий и варсонофий казанский чюдотворец и соловецкий игумен от святой русский и патриарси задумалисить а наш что волчонка вскотать завыть и блевать стать на отец свой говорить быть и не смыслить наш русский святый не человек быть что имя верить како претерп святой свой толикать досаждение я бедный горько а делать нечева стать побранить они колько мочь и последний слово рекл чистый есмить аз и прах прилепнуть от нога свой отрясать пред вы по писать луткий единый творять воля божий нежели тьма беззаконный
9,пожить у я с полгода на москва а я ещё не моглось в задний комнатка двое мы с он и много полежать да и встать 1000 поклон отбросать да сесть на пол и иной стоя час с три плакать а я таки лежать иной спать а иной немочься егда уж наплакаться гораздо тогда к я приступить долго ли ты протопоп лежать товый образумиться ведь ты поп и я немочься так я подымать говорить встать миленький батюшко ну таки встащися
10,он не уважать чтобы на он подаваться заявление чиклин подойти к козлов и спросить у он про весь я сегодня в соцстрах пойти становиться на пенсия сообщить козлов хотеть за весь следить против социальный вред и мелкобуржуазный бунт рабочий класс не царь сказать чиклин он бунт не бояться пускай не бояться согласиться козлов но хороший быть как говориться он постеречь жачев уже быть вблизи на тележка и откатиться назад он разогнуться вперёд и ударить с весь скорость козлов молчаливый голова в живот
11,федеральный закон от 2005 93 фз наказываться штраф в размер от сто тысяча до пятьсот тысяча рубль или в размер заработный плата или иной доход осудить за период от один год до три год либо лишение право занимать определённый должность или заниматься определённый деятельность на срок от один год до пять год либо обязательный работа на срок от сто восемьдесят до двести сорок часы либо исправительный работа на срок от один год до два год либо лишение свобода на срок до два год федеральный закон от 2003 162 фз федеральный закон от 2005 93 фз внести изменение в примечание к статья вступать в сила по истечение шесть год после день вступление в сила указанный федеральный закон
12,изнасилование а повлечь по неосторожность смерть потерпевший б повлечь по неосторожность причинение тяжкий вред здоровье потерпевший заражение она или иной тяжкий последствие в потерпевший заведомо не достигнуть четырнадцатилетний возраст наказываться лишение свобода на срок от восемь до пятнадцать год о судебный практика по дело о преступление предусмотренный статья 132 ук рф сантиметр постановление пленум верховный суд рф от 2004 11 мужеложство лесбиянство или иной действие сексуальный характер с применение насилие или с угроза он применение к потерпевший потерпевший или к другой лицо либо с использование беспомощный состояние потерпевший потерпевший наказываться лишение свобода на срок от три до шесть год
13,хороший стать никто неведомый хороший стать невидимый тень ты форма отлив человек сотворить издавна что ж наш природа различный изъян полный коль форма из глина прекрасный зачем разбивать а если плохой этот форма чей в это вино ни увеличить мы нельзя ни приуменьшить свой удел не огорчаться же мудрец пустой иль важный дело увы я к вывод прийти твой ль судьба мой ль судьба не воск в рука никто досель придать она форма не суметь весь и зло и добро что людская скрывать природа высокий воля подвластный и здесь не дать мы свобода
14,федеральный закон от 2003 162 фз 3 деяние предусмотренный часть один и два настоящий статья совершенный организовать группа либо с применение насилие опасный для жизнь или здоровье наказываться лишение свобода на срок от пять до двенадцать год незаконный пересечение государственный граница российский федерация 1 пересечение государственный граница российский федерация без действительный документ на право въезд в российский федерация или выезд из российский федерация либо без надлежащий разрешение получить в порядок установленный законодательство российский федерация в ред федеральный закон от 2003 98 фз наказываться штраф в размер до двести тысяча рубль или в размер заработный плата или иной доход осудить за период до восемнадцать месяц либо лишение свобода на срок до два год
15,писаться конечно а то в океан послать бедняк нигде не страшно я б давно записаться только зоя сеять бояться если соя то она ведь официальный злак ну не сеять я учесть твой психология записать бедняк в колхоз активист вынужденный быть дать он квитанция в приём в членство и в тот что в колхоз не быть зоя и выдумать здесь же надлежащий форма для этот квитанция так как бедняк нипочём не уходить без нея снаружи в то время весь гуща падать холодный снег земля от снег стать смирный но звук середняцкий настроение мешать наступить сплошной тишина
16,ну прекрасно сказать тогда чиклин а кто ж они убить мы товарищ чиклин неизвестно мы сам жить нечаянно произнести чиклин и сделать мужик удар в лицо чтоб он стать жить сознательно мужик быть упасть но побояться далеко уклоняться даба чиклин не подумать про он зажиточный и ещё близкий предстать перед он желать посильный изувечиться и затем исходатайствовать себя посредством мучение право жизнь бедняк чиклин видеть перед себя такой существо двинуть он механически в живот и мужик опрокинуться закрыть свой жёлтый глаз
17,федеральный закон от 2003 162 фз примечание под другой механический транспортный средство в настоящий статья пониматься троллейбус а также трактор и иной самоходный машина мотоцикл и иной механический транспортный средство федеральный закон от 2003 162 фз недоброкачественный ремонт транспортный средство и выпуск они в эксплуатация с технический неисправность 1 недоброкачественный ремонт транспортный средство путь сообщение средство сигнализация или связь либо иной транспортный оборудование а равно выпуск в эксплуатация технически неисправный транспортный средство лицо ответственный за технический состояние транспортный средство если этот деяние повлечь по неосторожность причинение тяжкий вред здоровье человек в ред
18,писать то что с они нельзя не согласиться а ты попробовать не согласиться в слеза произнести активный человек эх горе я с революция серьёзно опечалиться жачев где же ты самый пущий стерва идти дорогой получить от увечный воин почувствовать мысль и одиночество не желать безответно тратить средство на государство и будущее поколение активист снять с настя свой пиджак раз он устранять пусть масса сам греться и с пиджак в рука он стать посреди оргдома без дальнейший стремление к жизнь весь в крупный слеза и в тот сомнение душа что капитализм пожалуй мочь ещё явиться
19,федеральный закон от 2003 162 фз статья 305 вынесение заведомо неправосудный приговор решение или иной судебный акт 1 вынесение судья судья заведомо неправосудный приговор решение или иной судебный акт наказываться штраф в размер до триста тысяча рубль или в размер заработный плата или иной доход осудить за период до два год либо лишение свобода на срок до четыре год федеральный закон от 2003 162 фз 2 то же деяние связанный с вынесение незаконный приговор суд к лишение свобода или повлечь иной тяжкий последствие наказываться лишение свобода на срок от три до десять год
20,от бездна мрачный надир до кульминация кейван я разрешить загадка мир трудиться над они неустанно трудный узел вселенная распутать я проникновенно и лишь узел простой смерть не развязать я вот что странно коль расти из корень счастие вечный ветвь торжество если жизнь одежда тесный стать тело твой не надеяться на телесный на походный свой шатёр ибо слабый весь четыре древние колышек он гнать я по пята судьба на путь роковой каждый дело мой дурной завершать конец в путь снарядиться душить пожитки свой собрать молвить негде я жить убогий мой рушиться дом
21,прушевский с удивление привыкнуть к печаль человек наблюдать точный нежность и охладить сомкнутый сила отдалённый монумент он ещё не видеть такой вера и свобода в сложить камень и не знать самосветящийся закон для серый цвет свой родина как остров стоялый среди остальной новостроящийся мир этот белый сюжет сооружение и успокоенно светиться но не весь быть белый в тот здание в иной место они иметь синий жёлтый и зелёный цвет что придавать имя нарочный красота детский изображение когда же это выстроить с огорчение сказать прушевский он уютный быть чувствовать скорбь на земной потухший звезда чужое и дальний счастие возбуждать в немой стыд и тревога он бы хотеть не сознавать чтобы вечно строиться и недостроенный мир быть похожий на он разрушить жизнь
22,деяние предусмотренный часть один или два настоящий статья совершенный с использование для занятие проституция лицо заведомо не достигнуть четырнадцатилетний возраст наказываться лишение свобода на срок от три до десять год незаконный распространение порнографический материал или предмет незаконный изготовление в цель распространение или рекламирование распространение рекламирование порнографический материал или предмет а равно незаконный торговля печатный издание кино или видеоматериал изображение или иной предмет порнографический характер наказываться штраф в размер от сто тысяча до триста тысяча рубль или в размер заработный плата или иной доход осудить за период от один год до два год либо лишение свобода на срок до два год
